{
  "meta": {
    "generated": "2025-10-09T20:58:29.492936Z",
    "game_version": "1.0.0",
    "total_seeds": 1,
    "total_players": 1,
    "export_source": "game-repository",
    "source_file": "leaderboard_natural-game-over-seed_c53217a3.json",
    "note": "Exported from actual game leaderboard data"
  },
  "seed": "leaderboard_natural-game-over-c53217a3",
  "economic_model": "Bootstrap_v0.4.1",
  "entries": [
    {
      "score": 43,
      "player_name": "Anonymous",
      "date": "2025-09-13T10:36:25.783203",
      "level_reached": 43,
      "game_mode": "Bootstrap_v0.4.1",
      "duration_seconds": 0.137584,
      "entry_uuid": "d5414214-1003-4fb3-b333-ac97abc70641",
      "final_doom": 25.0,
      "final_money": 100000,
      "final_staff": 5,
      "final_reputation": 50.0,
      "final_compute": 10000,
      "research_papers_published": 0,
      "technical_debt_accumulated": 0
    }
  ]
}