{
  "meta": {
    "generated": "2025-10-09T20:58:29.505355Z",
    "game_version": "1.0.0",
    "total_seeds": 1,
    "total_players": 1,
    "export_source": "game-repository",
    "source_file": "leaderboard_test_session_seed_8fb1684c.json",
    "note": "Exported from actual game leaderboard data"
  },
  "seed": "leaderboard_test_session_8fb1684c",
  "economic_model": "Bootstrap_v0.4.1",
  "entries": [
    {
      "score": 4,
      "player_name": "Apex Intelligence",
      "date": "2025-09-29T13:24:02.044096",
      "level_reached": 4,
      "game_mode": "Bootstrap_v0.4.1",
      "duration_seconds": 0.006391,
      "entry_uuid": "222c724c-472e-43b3-b48a-217e0c11572b",
      "final_doom": 25.0,
      "final_money": 100000,
      "final_staff": 5,
      "final_reputation": 50.0,
      "final_compute": 10000,
      "research_papers_published": 0,
      "technical_debt_accumulated": 0
    },
    {
      "score": 4,
      "player_name": "Apex Intelligence",
      "date": "2025-09-29T16:42:06.844704",
      "level_reached": 4,
      "game_mode": "Bootstrap_v0.4.1",
      "duration_seconds": 0.009943,
      "entry_uuid": "a59508aa-34c8-4f27-aef4-9fda64cf51e9",
      "final_doom": 25.0,
      "final_money": 100000,
      "final_staff": 5,
      "final_reputation": 50.0,
      "final_compute": 10000,
      "research_papers_published": 0,
      "technical_debt_accumulated": 0
    },
    {
      "score": 4,
      "player_name": "Apex Intelligence",
      "date": "2025-09-29T20:26:44.088800",
      "level_reached": 4,
      "game_mode": "Bootstrap_v0.4.1",
      "duration_seconds": 0.005917,
      "entry_uuid": "e0fa3e90-0829-4fb8-87f5-e8a1ee48ecd8",
      "final_doom": 25.0,
      "final_money": 100000,
      "final_staff": 5,
      "final_reputation": 50.0,
      "final_compute": 10000,
      "research_papers_published": 0,
      "technical_debt_accumulated": 0
    },
    {
      "score": 4,
      "player_name": "Apex Intelligence",
      "date": "2025-09-29T20:35:01.302380",
      "level_reached": 4,
      "game_mode": "Bootstrap_v0.4.1",
      "duration_seconds": 0.004625,
      "entry_uuid": "ff7cf1f7-94df-4f89-a5af-4905ac9d4987",
      "final_doom": 25.0,
      "final_money": 100000,
      "final_staff": 5,
      "final_reputation": 50.0,
      "final_compute": 10000,
      "research_papers_published": 0,
      "technical_debt_accumulated": 0
    }
  ]
}