{
  "meta": {
    "generated": "2025-10-09T20:29:21.282387Z",
    "game_version": "1.0.0",
    "total_seeds": 1,
    "total_players": 1,
    "export_source": "game-repository",
    "source_file": "leaderboard_test_seed_8fb1684c.json",
    "note": "Exported from actual game leaderboard data"
  },
  "seed": "leaderboard_test_8fb1684c",
  "economic_model": "Bootstrap_v0.4.1",
  "entries": [
    {
      "score": 1,
      "player_name": "Zenith Dynamics",
      "date": "2025-09-29T13:24:02.151007",
      "level_reached": 1,
      "game_mode": "Bootstrap_v0.4.1",
      "duration_seconds": 0.002525,
      "entry_uuid": "139c71e1-5f50-44f7-8dd3-d6ac5e0a266e",
      "final_doom": 25.0,
      "final_money": 100000,
      "final_staff": 5,
      "final_reputation": 50.0,
      "final_compute": 10000,
      "research_papers_published": 0,
      "technical_debt_accumulated": 0
    },
    {
      "score": 1,
      "player_name": "Zenith Dynamics",
      "date": "2025-09-29T16:42:07.005118",
      "level_reached": 1,
      "game_mode": "Bootstrap_v0.4.1",
      "duration_seconds": 0.004448,
      "entry_uuid": "99790a9f-5130-405b-aee1-2d32c05d250b",
      "final_doom": 25.0,
      "final_money": 100000,
      "final_staff": 5,
      "final_reputation": 50.0,
      "final_compute": 10000,
      "research_papers_published": 0,
      "technical_debt_accumulated": 0
    },
    {
      "score": 1,
      "player_name": "Zenith Dynamics",
      "date": "2025-09-29T20:26:44.167481",
      "level_reached": 1,
      "game_mode": "Bootstrap_v0.4.1",
      "duration_seconds": 0.002365,
      "entry_uuid": "14b2d2ae-8fd9-461f-873f-f8716c66f76c",
      "final_doom": 25.0,
      "final_money": 100000,
      "final_staff": 5,
      "final_reputation": 50.0,
      "final_compute": 10000,
      "research_papers_published": 0,
      "technical_debt_accumulated": 0
    },
    {
      "score": 1,
      "player_name": "Zenith Dynamics",
      "date": "2025-09-29T20:35:01.387018",
      "level_reached": 1,
      "game_mode": "Bootstrap_v0.4.1",
      "duration_seconds": 0.001669,
      "entry_uuid": "d7fe4342-3f8b-4276-8439-eb3230291ebf",
      "final_doom": 25.0,
      "final_money": 100000,
      "final_staff": 5,
      "final_reputation": 50.0,
      "final_compute": 10000,
      "research_papers_published": 0,
      "technical_debt_accumulated": 0
    }
  ]
}