{
  "meta": {
    "generated": "2025-10-09T20:58:29.483294Z",
    "game_version": "1.0.0",
    "total_seeds": 1,
    "total_players": 2,
    "export_source": "game-repository",
    "source_file": "leaderboard_202537_c53217a3.json",
    "note": "Exported from actual game leaderboard data"
  },
  "seed": "leaderboard_202537_c53217a3",
  "economic_model": "Bootstrap_v0.4.1",
  "entries": [
    {
      "score": 1,
      "player_name": "Anonymous",
      "date": "2025-09-13T11:17:18.048610",
      "level_reached": 1,
      "game_mode": "Bootstrap_v0.4.1",
      "duration_seconds": 3.666186,
      "entry_uuid": "631a91a2-353c-47eb-8785-e6fd43c2c364",
      "final_doom": 25.0,
      "final_money": 100000,
      "final_staff": 5,
      "final_reputation": 50.0,
      "final_compute": 10000,
      "research_papers_published": 0,
      "technical_debt_accumulated": 0
    },
    {
      "score": 1,
      "player_name": "Anonymous",
      "date": "2025-09-13T11:21:36.359208",
      "level_reached": 1,
      "game_mode": "Bootstrap_v0.4.1",
      "duration_seconds": 12.198839,
      "entry_uuid": "77a13f0d-c5fa-480d-b765-fb45a625909d",
      "final_doom": 25.0,
      "final_money": 100000,
      "final_staff": 5,
      "final_reputation": 50.0,
      "final_compute": 10000,
      "research_papers_published": 0,
      "technical_debt_accumulated": 0
    },
    {
      "score": 1,
      "player_name": "Pulsar AI",
      "date": "2025-09-13T16:04:10.131388",
      "level_reached": 1,
      "game_mode": "Bootstrap_v0.4.1",
      "duration_seconds": 9.05036,
      "entry_uuid": "90b57f73-e3ca-456f-8180-a825a157ae2b",
      "final_doom": 25.0,
      "final_money": 100000,
      "final_staff": 5,
      "final_reputation": 50.0,
      "final_compute": 10000,
      "research_papers_published": 0,
      "technical_debt_accumulated": 0
    },
    {
      "score": 1,
      "player_name": "Pulsar AI",
      "date": "2025-09-13T16:06:55.399729",
      "level_reached": 1,
      "game_mode": "Bootstrap_v0.4.1",
      "duration_seconds": 0.995275,
      "entry_uuid": "c3fbf91a-bc85-4d1a-b4b5-c67367b3682e",
      "final_doom": 25.0,
      "final_money": 100000,
      "final_staff": 5,
      "final_reputation": 50.0,
      "final_compute": 10000,
      "research_papers_published": 0,
      "technical_debt_accumulated": 0
    },
    {
      "score": 1,
      "player_name": "Pulsar AI",
      "date": "2025-09-14T01:15:47.330356",
      "level_reached": 1,
      "game_mode": "Bootstrap_v0.4.1",
      "duration_seconds": 21.7336,
      "entry_uuid": "e8de6c9d-9a4a-4ad7-b0e7-60e31c67a974",
      "final_doom": 25.0,
      "final_money": 100000,
      "final_staff": 5,
      "final_reputation": 50.0,
      "final_compute": 10000,
      "research_papers_published": 0,
      "technical_debt_accumulated": 0
    },
    {
      "score": 1,
      "player_name": "Pulsar AI",
      "date": "2025-09-14T01:21:00.047436",
      "level_reached": 1,
      "game_mode": "Bootstrap_v0.4.1",
      "duration_seconds": 0.694016,
      "entry_uuid": "2171c11b-9116-44ae-bf04-38361668cd9d",
      "final_doom": 25.0,
      "final_money": 100000,
      "final_staff": 5,
      "final_reputation": 50.0,
      "final_compute": 10000,
      "research_papers_published": 0,
      "technical_debt_accumulated": 0
    },
    {
      "score": 1,
      "player_name": "Pulsar AI",
      "date": "2025-09-14T02:32:19.203153",
      "level_reached": 1,
      "game_mode": "Bootstrap_v0.4.1",
      "duration_seconds": 165.393368,
      "entry_uuid": "97201da2-57ea-41b7-adab-93cb94dd1654",
      "final_doom": 25.0,
      "final_money": 100000,
      "final_staff": 5,
      "final_reputation": 50.0,
      "final_compute": 10000,
      "research_papers_published": 0,
      "technical_debt_accumulated": 0
    }
  ]
}