{
  "meta": {
    "generated": "2025-10-09T20:29:21.269099Z",
    "game_version": "1.0.0",
    "total_seeds": 1,
    "total_players": 1,
    "export_source": "game-repository",
    "source_file": "leaderboard_test-turn7_8fb1684c.json",
    "note": "Exported from actual game leaderboard data"
  },
  "seed": "leaderboard_test-turn7_8fb1684c",
  "economic_model": "Bootstrap_v0.4.1",
  "entries": [
    {
      "score": 8,
      "player_name": "Quantum Leap",
      "date": "2025-09-29T13:24:39.895758",
      "level_reached": 8,
      "game_mode": "Bootstrap_v0.4.1",
      "duration_seconds": 0.015845,
      "entry_uuid": "fe52fa04-5222-4850-8fa2-9e182e1a7f56",
      "final_doom": 25.0,
      "final_money": 100000,
      "final_staff": 5,
      "final_reputation": 50.0,
      "final_compute": 10000,
      "research_papers_published": 0,
      "technical_debt_accumulated": 0
    },
    {
      "score": 8,
      "player_name": "Quantum Leap",
      "date": "2025-09-29T16:42:53.990242",
      "level_reached": 8,
      "game_mode": "Bootstrap_v0.4.1",
      "duration_seconds": 0.022423,
      "entry_uuid": "044af23f-97c2-4dcd-b40d-917a783d5832",
      "final_doom": 25.0,
      "final_money": 100000,
      "final_staff": 5,
      "final_reputation": 50.0,
      "final_compute": 10000,
      "research_papers_published": 0,
      "technical_debt_accumulated": 0
    },
    {
      "score": 8,
      "player_name": "Quantum Leap",
      "date": "2025-09-29T20:27:12.252832",
      "level_reached": 8,
      "game_mode": "Bootstrap_v0.4.1",
      "duration_seconds": 0.012799,
      "entry_uuid": "95dafb50-b580-48da-beea-3ecbb2a866b1",
      "final_doom": 25.0,
      "final_money": 100000,
      "final_staff": 5,
      "final_reputation": 50.0,
      "final_compute": 10000,
      "research_papers_published": 0,
      "technical_debt_accumulated": 0
    },
    {
      "score": 8,
      "player_name": "Quantum Leap",
      "date": "2025-09-29T20:35:30.073817",
      "level_reached": 8,
      "game_mode": "Bootstrap_v0.4.1",
      "duration_seconds": 0.012168,
      "entry_uuid": "63bae760-1672-448e-afa4-3d5e42b4602d",
      "final_doom": 25.0,
      "final_money": 100000,
      "final_staff": 5,
      "final_reputation": 50.0,
      "final_compute": 10000,
      "research_papers_published": 0,
      "technical_debt_accumulated": 0
    }
  ]
}