{
  "meta": {
    "generated": "2025-10-09T20:29:21.292620Z",
    "game_version": "1.0.0",
    "total_seeds": 1,
    "total_players": 1,
    "export_source": "game-repository",
    "source_file": "leaderboard_test_session_seed_01463e1d.json",
    "note": "Exported from actual game leaderboard data"
  },
  "seed": "leaderboard_test_session_01463e1d",
  "economic_model": "Bootstrap_v0.4.1",
  "entries": [
    {
      "score": 4,
      "player_name": "Apex Intelligence",
      "date": "2025-09-28T12:06:47.203931",
      "level_reached": 4,
      "game_mode": "Bootstrap_v0.4.1",
      "duration_seconds": 0.008339,
      "entry_uuid": "a2ede020-e285-4de6-853b-7d887aaf5518",
      "final_doom": 25.0,
      "final_money": 100000,
      "final_staff": 5,
      "final_reputation": 50.0,
      "final_compute": 10000,
      "research_papers_published": 0,
      "technical_debt_accumulated": 0
    },
    {
      "score": 4,
      "player_name": "Apex Intelligence",
      "date": "2025-09-28T12:07:45.587890",
      "level_reached": 4,
      "game_mode": "Bootstrap_v0.4.1",
      "duration_seconds": 0.010471,
      "entry_uuid": "6e155cf7-0d7e-4165-bbc4-d69245808635",
      "final_doom": 25.0,
      "final_money": 100000,
      "final_staff": 5,
      "final_reputation": 50.0,
      "final_compute": 10000,
      "research_papers_published": 0,
      "technical_debt_accumulated": 0
    },
    {
      "score": 4,
      "player_name": "Apex Intelligence",
      "date": "2025-09-28T13:14:01.049605",
      "level_reached": 4,
      "game_mode": "Bootstrap_v0.4.1",
      "duration_seconds": 0.004384,
      "entry_uuid": "74a5752a-ba63-44ca-9b3a-46e381398e73",
      "final_doom": 25.0,
      "final_money": 100000,
      "final_staff": 5,
      "final_reputation": 50.0,
      "final_compute": 10000,
      "research_papers_published": 0,
      "technical_debt_accumulated": 0
    },
    {
      "score": 4,
      "player_name": "Apex Intelligence",
      "date": "2025-09-29T07:42:24.402649",
      "level_reached": 4,
      "game_mode": "Bootstrap_v0.4.1",
      "duration_seconds": 0.007981,
      "entry_uuid": "019713cb-6c20-4ec2-97f6-d50d31394baf",
      "final_doom": 25.0,
      "final_money": 100000,
      "final_staff": 5,
      "final_reputation": 50.0,
      "final_compute": 10000,
      "research_papers_published": 0,
      "technical_debt_accumulated": 0
    },
    {
      "score": 4,
      "player_name": "Apex Intelligence",
      "date": "2025-09-29T08:21:01.623747",
      "level_reached": 4,
      "game_mode": "Bootstrap_v0.4.1",
      "duration_seconds": 0.006107,
      "entry_uuid": "9b8bbca5-36be-47bf-8b46-7d051ec8fbdf",
      "final_doom": 25.0,
      "final_money": 100000,
      "final_staff": 5,
      "final_reputation": 50.0,
      "final_compute": 10000,
      "research_papers_published": 0,
      "technical_debt_accumulated": 0
    },
    {
      "score": 4,
      "player_name": "Apex Intelligence",
      "date": "2025-09-29T08:22:46.136078",
      "level_reached": 4,
      "game_mode": "Bootstrap_v0.4.1",
      "duration_seconds": 0.005279,
      "entry_uuid": "57dd6d1b-7450-4951-8236-fdebb02d9950",
      "final_doom": 25.0,
      "final_money": 100000,
      "final_staff": 5,
      "final_reputation": 50.0,
      "final_compute": 10000,
      "research_papers_published": 0,
      "technical_debt_accumulated": 0
    },
    {
      "score": 4,
      "player_name": "Apex Intelligence",
      "date": "2025-09-29T08:58:16.042795",
      "level_reached": 4,
      "game_mode": "Bootstrap_v0.4.1",
      "duration_seconds": 0.005306,
      "entry_uuid": "3fdc63ff-3eb6-4e70-992d-bb922114907c",
      "final_doom": 25.0,
      "final_money": 100000,
      "final_staff": 5,
      "final_reputation": 50.0,
      "final_compute": 10000,
      "research_papers_published": 0,
      "technical_debt_accumulated": 0
    },
    {
      "score": 4,
      "player_name": "Apex Intelligence",
      "date": "2025-09-29T08:59:27.800541",
      "level_reached": 4,
      "game_mode": "Bootstrap_v0.4.1",
      "duration_seconds": 0.008542,
      "entry_uuid": "d08f8852-cb0a-43a4-a26b-4f2e2e6f1a32",
      "final_doom": 25.0,
      "final_money": 100000,
      "final_staff": 5,
      "final_reputation": 50.0,
      "final_compute": 10000,
      "research_papers_published": 0,
      "technical_debt_accumulated": 0
    }
  ]
}