{
  "meta": {
    "generated": "2026-07-16T00:00:00Z",
    "game_version": "v0.11.0",
    "total_players": 2,
    "export_source": "fixture"
  },
  "seed": "fixture_live_seed",
  "economic_model": "Bootstrap_v0.11.0",
  "entries": [
    {
      "score": 42, "player_name": "Test Alpha", "date": "2026-07-16",
      "level_reached": 42, "game_mode": "standard", "duration_seconds": 300.0,
      "entry_uuid": "fixture-entry-1", "final_doom": 18.5, "final_money": 50000,
      "final_staff": 5, "final_reputation": 10.0, "final_compute": 100
    },
    {
      "score": 37, "player_name": "Test Beta", "date": "2026-07-16",
      "level_reached": 37, "game_mode": "standard", "duration_seconds": 280.0,
      "entry_uuid": "fixture-entry-2", "final_doom": 22.0, "final_money": 40000,
      "final_staff": 4, "final_reputation": 8.0, "final_compute": 90
    }
  ]
}
