{
  "meta": {
    "generated": "2025-10-09T20:29:21.219920Z",
    "game_version": "1.0.0",
    "total_seeds": 1,
    "total_players": 4,
    "export_source": "game-repository",
    "source_file": "leaderboard_party-demo-seed_c53217a3.json",
    "note": "Exported from actual game leaderboard data"
  },
  "seed": "leaderboard_party-demo-c53217a3",
  "economic_model": "Bootstrap_v0.4.1",
  "entries": [
    {
      "score": 25,
      "player_name": "Epic AI Labs",
      "date": "2025-09-13T16:01:32.035414",
      "level_reached": 25,
      "game_mode": "Bootstrap_v0.4.1",
      "duration_seconds": 4.1e-05,
      "entry_uuid": "cacd160c-6c5f-42f5-a073-d06db9cf70c7",
      "final_doom": 25.0,
      "final_money": 100000,
      "final_staff": 5,
      "final_reputation": 50.0,
      "final_compute": 10000,
      "research_papers_published": 0,
      "technical_debt_accumulated": 0
    },
    {
      "score": 20,
      "player_name": "Demo Labs",
      "date": "2025-09-13T16:01:32.044843",
      "level_reached": 20,
      "game_mode": "Bootstrap_v0.4.1",
      "duration_seconds": 1.2e-05,
      "entry_uuid": "9e07cfe2-d015-4bdf-b949-8a82ed462ca3",
      "final_doom": 25.0,
      "final_money": 100000,
      "final_staff": 5,
      "final_reputation": 50.0,
      "final_compute": 10000,
      "research_papers_published": 0,
      "technical_debt_accumulated": 0
    },
    {
      "score": 15,
      "player_name": "Test Systems",
      "date": "2025-09-13T16:01:32.052106",
      "level_reached": 15,
      "game_mode": "Bootstrap_v0.4.1",
      "duration_seconds": 1.1e-05,
      "entry_uuid": "4652a781-6f85-4128-9960-5dac250b25e3",
      "final_doom": 25.0,
      "final_money": 100000,
      "final_staff": 5,
      "final_reputation": 50.0,
      "final_compute": 10000,
      "research_papers_published": 0,
      "technical_debt_accumulated": 0
    },
    {
      "score": 1,
      "player_name": "Pulsar AI",
      "date": "2025-09-14T02:22:07.341927",
      "level_reached": 1,
      "game_mode": "Bootstrap_v0.4.1",
      "duration_seconds": 0.057518,
      "entry_uuid": "6f5ca8b6-ebd3-4f28-821f-fecaece08048",
      "final_doom": 25.0,
      "final_money": 100000,
      "final_staff": 5,
      "final_reputation": 50.0,
      "final_compute": 10000,
      "research_papers_published": 0,
      "technical_debt_accumulated": 0
    }
  ]
}